{
  "schema_version": "1.0.0",
  "product_passport_id": "pp_fixture_honest_anti_fit",
  "seller_id": "seller_fixture_b",
  "product_id": "product_fixture_b",
  "version": 1,
  "public_identity": { "seller_name": "Relay Systems", "product_name": "RelayNote", "edition": "Team", "geographies": ["US"] },
  "source_material": [
    { "source_id": "src_fixture_b_internal", "classification": "seller_confidential", "title": "Fixture B internal fit research", "internal_location": "seller-private://fixture-b/fit-research-v1", "owner_role": "product_owner" }
  ],
  "roadmap_notes": ["Shared external-client workspaces are under private roadmap review and are not promised."],
  "availability_capacity": { "new_workspaces_available": true, "remaining_onboarding_slots": 10, "checked_at": "2026-08-02T00:00:00Z" },
  "private_negotiation_bounds": { "floor_amount": "69.00", "currency": "USD", "maximum_discount_percent": 15 },
  "fulfillment_operations": { "internal_runbook": "seller-private://fixture-b/runbook", "service_account_ref": "svc_fixture_b_private", "escalation_role": "fulfillment_manager" },
  "approved_positioning_library": [
    { "angle_id": "angle_fixture_b_fast_setup", "text": "Fast setup for internal-only meeting workflows.", "claim_ids": ["claim_fixture_b_deploy"] }
  ],
  "unpublished_constraints": ["Private roadmap timing and negotiation bounds are excluded from publication."],
  "pack_source": {
    "category_ids": ["meeting_intelligence_client_services_v1"],
    "jtbd_ids": ["capture_meeting_decisions"],
    "facts": [
      { "field": "product.trains_on_customer_data", "value": false, "evidence_claim_ids": ["claim_fixture_b_training"] },
      { "field": "product.data_residency", "value": "US", "evidence_claim_ids": ["claim_fixture_b_residency"] },
      { "field": "product.source_linked_answers", "value": true, "evidence_claim_ids": ["claim_fixture_b_sources"] },
      { "field": "product.guest_recording_notice", "value": true, "evidence_claim_ids": ["claim_fixture_b_notice"] },
      { "field": "product.supports_shared_client_workspace", "value": false, "evidence_claim_ids": ["claim_fixture_b_workspace"] },
      { "field": "product.admin_hours_per_month", "value": 1, "evidence_claim_ids": ["claim_fixture_b_admin"] },
      { "field": "product.deployment_days", "value": 1, "evidence_claim_ids": ["claim_fixture_b_deploy"] },
      { "field": "product.native_integrations", "value": ["google_workspace", "slack", "zoom"], "evidence_claim_ids": ["claim_fixture_b_integrations"] }
    ],
    "fit_rules": [{ "rule_id": "fit_fixture_b_seats", "kind": "fit", "all": [{ "field": "buyer.seat_count", "op": "lte", "value": 50 }], "reason_code": "SEAT_RANGE_SUPPORTED", "display_reason": "The Team edition supports up to 50 seats.", "evidence_claim_ids": ["claim_fixture_b_seats"], "severity": "hard" }],
    "anti_fit_rules": [{ "rule_id": "af_fixture_b_shared_client_data", "kind": "anti_fit", "all": [{ "field": "buyer.shared_client_workspace_required", "op": "eq", "value": true }, { "field": "buyer.client_conversations_restricted", "op": "eq", "value": true }], "reason_code": "SHARED_CLIENT_WORKSPACE_UNSUPPORTED", "display_reason": "Fixture B is not offered for restricted client conversations in shared external-client workspaces.", "evidence_claim_ids": ["claim_fixture_b_workspace"], "severity": "hard" }],
    "dependency_rules": [],
    "claim_ids": ["claim_fixture_b_training", "claim_fixture_b_residency", "claim_fixture_b_sources", "claim_fixture_b_notice", "claim_fixture_b_workspace", "claim_fixture_b_admin", "claim_fixture_b_deploy", "claim_fixture_b_integrations", "claim_fixture_b_seats"],
    "offer_ids": ["offer_fixture_b_monthly"],
    "fulfillment_public_summary": "One workspace and ten seat entitlements are provisioned after verified payment."
  },
  "publication_allowlist": ["public_identity", "pack_source", "approved_positioning_library"],
  "compilation_history": [{ "compilation_id": "compile_fixture_b_v1", "target_pack_version": 1, "reviewer_role": "seller_reviewer", "result": "approved", "at": "2026-08-02T00:00:00Z" }],
  "created_at": "2026-08-01T00:00:00Z"
}
